<?xml version="1.0" standalone="yes"?>
<xsd:schema id="Doctors" xmlns="" xmlns:xsd="http://www.w3.org/2001/XMLSchema" 
      targetNamespace="urn:MyUri" elementFormDefault="qualified" 
      xmlns:msdata="urn:schemas-microsoft-com:xml-msdata">
  <xsd:element name="Doctors" msdata:IsDataSet="true" msdata:Locale="en-US">
    <xsd:complexType>
      <xsd:choice minOccurs="0" maxOccurs="unbounded">
        <xsd:element name="P">
          <xsd:complexType>
            <xsd:attribute name="Passenger" type="xsd:string" />
            <xsd:attribute name="Sex" type="xsd:string" />
            <xsd:attribute name="Age" type="xsd:string" />
          </xsd:complexType>
        </xsd:element>
      </xsd:choice>
    </xsd:complexType>
  </xsd:element>
</xsd:schema>