<Doctors
  xmlns="urn:MyUri"
  xmlns:xsi="http://www.w3.org/2001/XMLSchema-instance"
  xsi:schemaLocation="urn:MyUri doctors.xsd">
  <P Passenger="Frauenthal Dr. Henry William" Sex="male" Age="50"/>
  <P Passenger="Pain Dr. Alfred" Sex="male" Age="23"/>
  <P Passenger="Stahelin-Maeglin Dr. Max" Sex="male" Age="32"/>
  <P Passenger="Brewe Dr. Arthur Jackson" Sex="male"/>
  <P Passenger="Moraweck Dr. Ernest" Sex="male" Age="54"/>
  <P Passenger="Minahan Dr. William Edward" Sex="male" Age="44"/>
  <P Passenger="Leader Dr. Alice (Farnham)" Sex="female" Age="49"/>
</Doctors>